{
  "research_search_terms_id": "research_search_terms_luna_fit",
  "creator_profile_id": "creator_luna_fit",
  "updated_on": "2026-07-03",
  "items": [
    {
      "search_term_id": "search_term_luna_fit_001",
      "term": "lunch break stretch routine",
      "platform": "tiktok",
      "creator_profile_id": "creator_luna_fit",
      "usefulness_score": 74,
      "status": "active",
      "added_on": "2026-07-03",
      "updated_on": "2026-07-03",
      "last_evaluated_on": "2026-07-03",
      "rationale": "Surfaced two adjacent-creator desk-reset trends in the last run."
    }
  ]
}
